Education / Student life, scholarship, admission, grant, learning environment, study abroad, gap year, gossip, bookworm, distance learning, enroll in, *to play truant / to skive off*, absent, do an exam / sit an exam / take an exam, to retake a course, enforcement, at a slow / leisurely pace, a formal examination, to drop out of college, preschooler, vocational school, productive, primary school, secondary school, postgraduate school, attentive, to master a language, linguistic ability, to speak fluently, to take up a language, transmission of knowledge, intensive, to pay attention to, focus on, background, progress rapidly, adapt, interactive, face-to-face learning, to give feedback, interactive learning, higher education, a vocational course, to disrupt lessons, mandatory, educational, academic, learning atmosphere, extra-curricular activities, lecturer, academic subject, do badly in an exam, transcript, internship, social and cultural life, tuition fees, dormitory, reach one's full potential, bachelor's degree, hit the books, master's degree, mature student, public schools, schoolboy error, single-sex schools, to attend classes, to learn something by heart, to meet a deadline, to pass with flying colors, to pursue studying, to take a year out, concentrate, distraction, thesis, assignment, controversy, theoretical, to be poor at something, certificate, diploma, degree, to resit an exam, skip classes, memorable, specialty, to gain, schedule, inspiring, rewarding, vocational training, unwind, encouraging, strict, supportive, keep track of, strive, break, sincerity, to disclose, to recall, a heavy workload, bullying, competent, excel, to fall behind with your studies, to impose discipline, attendance record, tertiary education / higher education, to accumulate, bedtime reading, kindergarten / preschool education, a native speaker, to have a good grasp of

Work / Employment, 2*eager beaver*, burden, meet someone's needs, take on, doable, career, deadline, overtime, probation, handle someone's workload, handwork, out of steam, applicant, dream career, carry on, productivity, observe, ambition, manual work, retail staff, collaborate, follow in someone's footsteps, work things out, manually, dedicated, be willing to, sort out, associated with, keep someone from doing something, determined, by trial and error, stable, day off, get the hang of, apply for, strides, experience, dedicate, to confront, hardship, sacrifice, incentive, tension, criticism, to be engrossed in something, to recharge one's energy, career advancement, diligence, to earn a living, play an essential part in something, determination, perseverance, overcome, to acquire experience / knowledge / skill, to move up the career ladder, commitment, to proceed, self-motivated, demanding, work on, job prospects, work environment, job satisfaction, employee, be occupied with, works of craftsmanship, to work / perform miracles, white-collar, the world of work, make an honest living, make ends meet, cope with, devote to, huge challenge, future workforce, job-hunting / seeking / searching, workload, to job share, flexible work hours, sweated labour, guest workers, dead-end job, to make a living, life skills, transferable skills, level of competition, paperwork, work experience, career woman, colleague, client, retire, trainee, training course, freelance, well-paid, pay rise, sick pay, working environment, dream job, prospects, engaging, daily routine, in charge of, job opportunity, an occupation, profession, workplace, salary, unemployed, promotion, a workaholic, to be in charge of, to deal with, to involve

Health / Keeping Fit, refresh, energetic, boost someone's immune system, suffer, ageing, awareness, fit, healthy, sanitation, antioxidant, respiratory, detoxify, build up, soothe one's soul, life-threatening, fatal, immune system, look after, to be detrimental to health, a fitness regime, exhausted, remedy, to remedy, seasick, take care of, relieve pressure on, pass away, strain, detrimental, adverse, pose potential health risks, check-ups, longevity, be out of condition, get into shape, on safety grounds, to exert oneself, take up regular exercise, extreme sports, jogging, do aerobics / yoga, to be addicted to, a sedentary lifestyle, a team player, have a go, thoroughness, lifestyle, alleviate, to flourish, to take up sport, physical fitness, stamina, in good shape, burn a lot of calories, flexibility, meditation, well-being, obese, to provide someone with a healthy diet, to endure, mature, a sports fan, to keep fit, to work out at the gym, energize, to take regular exercise, mental health problem, to take gentle exercise, chronic illness / disease, diabetics, obesity, vaccines, basic necessities, sufferings, voluntary activities, to build muscle, football fan, football season, sports / fitness centre, sports facilities, champion, to warm up, maintain, nutrients, overweight, health benefits, health problems, in good health, in poor health, allergy, infection, vulnerable, sedentary lifestyle, cut down on, nervous breakdown, plastic surgery, sick leave, common cold, cancer, childhood diseases, addict, a check-up, a runny nose, chronic disease, painkillers, to diagnose, to stutter, alive and kicking, to break a habit, to black out, to be under the weather, to phone in sick, sick as a dog / to be at death's door, white as a sheet

Free time / Hobbies / Interest, take / have a nap, relax, to set aside time, take up, take part, be in the mood, tend to, (to) have a stroll, rock climbing, hiking, do-it-yourself, barely, fast-paced, on cloud nine, sedentary, every so often / from time to time, as a rule, frequently, give up, talent, flexible, daily routine, pursue one's passions, rarely / seldom, adopt a habit, take an interest in, drop in, hang out, take it easy, intriguing, to one's liking, put off, get into the habit of, give up, have a good command of, do a good deed, on a regular basis, go sightseeing, be passionate about, stay up late, keep up with, pursue a goal, share a common interest, for ages, on a daily basis, be more likely to, get into the habit of, get accustomed to, to embark on, take advantage of, when it comes to, routine, regular, every so often, once in a blue moon, used to, all year round, adventurous, have a whale of time, absorbed in, pleasurable, in favour of, lost the habit, laziness, amusement park / a theme park / funfair, slot machine, roller coaster, pottery, knitting, to mow the lawn

The Media, episode, mass media, online scams / internet fraud, breaking news, commercial advertising, live broadcast, classified ads, periodical, domestic news, to keep abreast of something, entertaining, informative, publication

Books and Films, moviegoer, sci-fi / science fiction, trailer, plot, spectacular, suitable for, venue, gig, sitcom, cinemagoer / moviegoer, fascinating, to come highly recommended, to stick in one's mind, keep one's eyes glued to screens, frustrated, to grasp, by leaps and bounds, curious, enthralling, broaden one's knowledge, reference book, bedtime story, blockbuster, action movie / kung fu film, animated film, horror film, release, subtitle, a feast for the eyes and ears, censorship, poetic, action-packed, addictive, creepy, dreary, heartbreaking, inspirational, tear-jerking, box office hit, e-reader, from cover to cover, hardcover, page turner, don't judge a book by its cover, to catch the latest movie, to flick through, to know like a hook

Urbanization, hometown, born and raised in, rustic, get stuck, sacred, metropolitan, commute, peak traffic hours, horn, honk, diverse, heavy traffic congestion, slow down, chaotic, world-famous, outskirts, the rush hour, municipal, traffic jam, facilities, eatery, crowded, modernize, architecture, competitive, challenging, dweller, outlet, metropolis, hustle and bustle, renovation, the lungs of the city, overcrowded, a passer-by, modes / means of transport, residential areas, retirement home, sanitation, emigration, over consumption, exploitation, safeguard, mitigate, inflated, living standards, the hectic pace of life, downtown, block of flats, upmarket, posh, luxurious, sumptuous, opulent, stressful, bustling, nursing home, medical care, divorce rate

Environment / Weather / Climate Change / Pollution, rubbish, littering, unsorted, diminish, to throw something out, waste treatment, impact, freshen, sparkle, drizzle, pollution, clear sky, get rid of, eco-friendly, emit, global warming, in all weathers, to be spoiled by, minimize, contamination, devastates, eliminate, gloomy, freezing / chilly, boiling hot, mild, chilly, degrees / celsius, to go below zero, cloudy weather, rainy weather, to be drenched (to the skin), downpour, to pour down, humid, heavy snow, snowstorm, windy weather, sunny weather, sunshine, changeable weather, mild climate, endangered species, environmentally friendly, exhaust fumes, fossil fuels, global warming, greenhouse effect, natural disaster, toxic waste, to become extinct, to be under threat, to get back to nature, biodiversity, contaminated, deforestation, ecosystem, exhaust emissions, contaminate, discharge, erosion, drought, recycle

Building / Accommodation / Houses / Flats / Rooms, skyrocketing, balcony, corridor, low-rise, cozy, narrow, apartment building, elegant, cramped, messy, cosy, scruffy, homely, run down, pavilion, chores, upkeep, historical monument, construction site, international hotel, installation, majestic, tatty, dusty, shabby, condo, high-rise, skyscraper, construction

Time, timely, once in a lifetime, annually, the coming year, up to the minute, a digital watch, punctual, upcoming, take your time, on time, right after, nowadays, age-old, down the road, right away, currently, time-consuming, in this day and age, ancient, brand-new, antique, middle-aged, contemporary, childhood, quality time

Travel / Tourism / Holidays, show someone around, take place, scenery, rays, from / out of nowhere, impressed, picturesque, ferry, mainland, scenery, overseas, breathtaking, crystal clear, stretch, endlessly, attract more visitors, show up, sandcastle, check into, fall away, full moon, campfire, to twinkle, to feel at peace, unforgettable, jump at the chance, a riot of colour, striking flowerbed, a leisurely stroll, avidly, wonderland, unique, pleasant, give someone a lift, drop someone off, impression, get familiar with, a myriad of, favourable conditions, stimulating, golden opportunity, breeze, dawn, therapeutic, inspire, vacation, holiday, frame of mind, exhilarating, invigorating, invaluable, breath-taking, to charm, hectic, valuable, enchanting, company, appealing, renowned, tranquility, ample, spacious, glory, relic, monotonous, dreary, impression, hospitality, to cater for, to broaden one's literary horizons, relics of the past, out of this world, nostalgia, to be thronged with tourists, backpackers, to get away from it all, the holiday of lifetime, ethnic groups, remote corners of the world, draw inspiration from, destination resorts, rowdy, drop off, pick up, no-stopping zones / no-parking zones, slum, pay a visit, historical places, local inhabitants, a thing of the past, glamour, overcharge, influx, far-flung, budget airline, exotic, immensely, cuisine, costly, luxury, tourist attraction, historic site, gigantic, immense, essential, incredible, refreshing, barbecue, buffet, picnic, snack, ready meal, all-inclusive, half-board, full-board, self-catering, to book (something), charter flight, far-off destination, getting away from it all, go off the beaten track, guided tour, head for, holiday brochure, holiday destination, hordes of tourists, in the middle of nowhere, out of season, package tour, picturesque village, places of interest, tourist trap, wildlife safari, youth hostel, remote, coastal, mountainous, rural, urban, means of transport, tourist, go skiing / skating / fishing / trekking

Music, concert venue, classical/pop/folk music, hip-hop, soothing, melody / rhyme, contemporary music, genres o music, catchy melody, meaningful lyrics, musical instrument, enrich, hi-fi devices, enlighten, rock music, catchy tune, live music, music to one's ears, have a rehearsal, opera, ringtone, melodious, live concert, rock band, tuneful, to face the music, to ring a bell, to sound like a broken record, to strike (hit) a false note

Food, pour, leftover food, catering food, cuisine, veggie, vegan, succulent, delectable, healthy eating habits, a vegetarian diet, plant foods, to be high in fiber, inadequate, tasty, fattening, food hygiene, appetizing, ripe, overcooked, grill, roast, steam, stew, portion, spoonful, bitter, crunchy, salty, savory, spicy, homemade food, nutritious, dine in / out, fussy eater, home-cooked food, in a walking distance of, mouth-watering, processed food, quick snack, restrain one's hunger, slap-up meal, starving hungry, the main meal, to be dying of hunger, to eat a balanced diet, to eat like a horse, to follow a recipe, to foot the bill, to grab a bite to eat, to have a sweet tooth, to play with your food, to spoil your appetite, to wine and dine, ingredients, Specialty, overeating

Technology, computer age, computer buff, desktop pc, gadget, geek, technology gadget, subscriber, to utilize, smiley, online, advances in technology, digital age, reliance, innovation, digital camera, to back up files, to be stuck behind a computer, to boot up, to go online

Friends, close friends, mutual friend, get on with, to create a strong bond, compliment, sound advice, care about, console, circle of virtual friends, enjoy each other's company, fair-weather friend, soul mate, get in touch with somebody, near and dear to someone, shoulder to cry on, to be through thick and thin, to be well-matched, to fall for someone ( to fall in love with someone), to get on like a house on fire, to get to know someone, to have a lot in common, to hit it off with somebody, to lose touch with someone

Towns and Cities, cosmopolitan, situated, population, specialty, cost of living, city dwellers, air quality, nightlife, vibrant, dynamic, holiday resort, seaside resort, be crazy about, spare time, check-in desk, sunbathe, get a suntan, destination, travel agency, tour guide, package holiday, hitchhike, set off, campsite, adjacent, homey, cafeteria, maid, guesthouse, neighborhood, studio flat, furnished, in good condition, clean and tidy, leisure center, exercise machines

Family / People / Relationships, reunion, role model, grown-up, tween, meet up, get-together, hold conversation, relatives, loved ones, affection, come up to me, calm someone down, optimistic, break up, look at/on the bright side, pessimistic, keep in touch, to be around the same age, saxophonist, extended family, the in-laws, a family gathering, acquaintance, fall out with, cheer somebody up, count on, hang around, befriend, healthy relationship, low-income people, in an attempt to, stranger, have somebody over, creative, express oneself, conservative, satisfying, patient, intriguing, come over, to see eye to eye, caretaker, volunteer, couch potato, well-respected, brilliant white, self-conscious, beer belly, bravery, to sympathize, conventionally, motivational, exemplary, moral, thoroughly, unconditional, restless, pop up, affectionate, crave, reflection, acceptably, imperative, bring up your offspring, generation gap, scriptwriter, dialogue, admirable, convincing, kind-hearted, give and take, lend someone a hand, to instill, genuine, alienate, empathize with, benevolent, goodwill, to lift one's spirits, harshness, to weigh on, carefree, to have high hopes, expectation, to appeal to somebody/something, to preserve, dominant, to terminate, to accomplish, have a great influence on something/somebody, well-known, piece of advice, approachable, sufficient, upper class, to plead, wrongdoing, needless to say / it goes without saying that, significance, to be an inspiration to, sleep soundly, courteous, ill-mannered, negligence, disrespect, to bond with somebody, enthusiastic, to aspire to, proficiency, lift one's spirits, to come highly recommended, freelancer, to drift apart, idolize, celebrity, innate, inspire, outlook, personable, to reunite, head over heels in love, to tie the knot, have ups and downs, to endear oneself to someone, to entice, to derive, to make small talk, to be wary of, to float on air, beyond one's expectation, to be in the peak of the condition, to offer conditional support, a dual-income family, newcomer, fulfill one's dream, potential, skill set, to carry out, look up to, admirable, charitable, reach the top, performance-enhancing, sensitive, be prone to, worthy, mentor, lack respect for, depression, generation gap, traditionalist, nuclear family, working parents, double income, realistic, underestimate, hardship, a win-win situation, embark on, family ties, working mothers, ties of kinship, slow off, mind, appreciate, contact, bear, be madly in love with, interpersonal relationships, well-being, nurture, longevity, single-parent family, paternal, maternal, in-laws, adorable, understanding and caring, sibling, adolescence, conflict, upbringing, build/develop/establish/form/have a relationship, a close relationship, a long-standing relationship, to take after somebody, foster family

Law / Crime / Punishment, disqualified, enact, comes into play, heavily fine, consequently, legalize, solid evidence, taken into consideration, confine, comply with, the crime rate, offenders, commit a crime, copyright, release, obligations, homeless, easy money, break the law, unregulated, to enforce strict regulation on, obligatory, burglary, insecurity, surveillance cameras, drug trafficking, address, compulsion, compel, to impose discipline

Business, fast food chain, collective level, build up, 8*indispensable*, amusement center, discount coupon, maximize customer satisfaction, ideal solution, make it to the top, benefits, to be user-friendly, beneficial, revenue, to make the most of something, reputable, to allocate somebody something, a lavish amount of something, upgrade, adjustment, to incorporate, market leader, enterprises, to generate, charitable donations, accountancy, an entrepreneur, imbalance, core values, run out, guarantee, renewable energy, contribute, boundless, to fund, prosperity, investing heavily, counterproductive, telemarketing

Money / Shopping / Clothing / Fashion, save up, budget, afford, economize, a bit pricey, affordable, a change of clothes, try clothes on, earn, to pay through the nose for something, reasonable, big money, fares, a waste of money, savings, discount store, a shopaholic

Personality / Feelings / Emotions, panic, sociable, discouraged, hooked, ingenious, hopeless, regrettable, warm-hearted, lose one's patience, amiable, suspicious, outstanding, considerate, thoughtful, bossy, officious, irresponsible, to feel relieved, shame, witty, convenient, awkward, proficient, insightful, envious, to be grateful to, insensitive, enviable, funny, humorous, amusing, shy, reserved, introverted, quiet, timid, confident, ambitious, self-confident, self-assured, extroverted, arrogant, angry, aggressive, bad-tempered, moody, irritable, charming, cheerful, vivacious, lively, helpful, sympathetic, honest, frank, reliable, genuine, sincere, gentle, calm, loving, bright, talented, open-minded, wise, stupid, immature, silly, foolish, unrealistic, depressing, unpleasant, frustrating, disappointing, embarrassing, embarrassed, incredulous, moved, pleased, delighted, relaxing, comfortable, peaceful, engrossing, exciting, energizing, delightful, magnificent

People & Things description / Physical appearance, appearance, figure, look / appearance, identical to, pretty, attractive, courageous, generous, grave, compact, sleek, practical, vanished, airy, enormous, clingy, dim, murky, horrible, disgusting, awful, unappealing, impressive, thrilling, untidy, crumbling

Liking / Disliking, be keen on, be quite into / be keen on something / be interested in something, fond of, to detest, can't stand (someone or something), be passionate about, have a passion for